Username,location,friend_count,review_count,photo_count,rating,date,review
Abby S.,"Oceanside, CA",0,3,,1.0,5/18/2016,"Probably will never go to this Applebee's again Wait was so long, Waitress was a complete BITCH her name is Celina L. ....after showing her specifically what I wanted, they come and bring us our food (guest of 3)  and my friend and I both let the girl who brought us our food know that, that wasn't what I had ordered. Manager comes out and she apologized and let me know it was going to be another 10 mins to get my food if they could get me anything she said as very nice but mind you, I'm pregnant and HUNGRY so I just told her I would wait for my food. I was fine with waiting if that was gonna be the case bc I didn't want to get full off anything else BUT what I had been craving. The manager comes bac almost right away with my food and said it was already made it was just a misunderstanding.  Anyways, the waitress didn't even apologize, instead gave me the dirtiest look as if I'd done something to her...it took her about 45 mins to come around and refill my friends drink but not mine...I was so thirsty that I just asked her if I could get a refill, she just looked at me and before she walked away I said ""thank you"" (she didn't say anything)  She goes back takes a good 10 mins before she and her manager come out with drinks I'm like cool here she comes...she walked right by me didn't give me my drink instead walks around the whole restaurant, to the back and 2 mins later comes back to give me my drink. I STILL thank her and she says NOTHING at all!! I couldn't believe how bad her service was! I have NEVER been treated that way and I would NEVER do that to anyone! this is the first time I give a bad ""review"" but I just feel like I had to say something so that hopefully nobody else gets treated the way I was treated by her again.  The steak that I had along with the veggies and mashed potatoes were DELICIOUS exactly how I was craving it, it was just too bad that 1 person killed it all"
Leon H.,"Oceanside, CA",25,37,102,3.0,9/4/2015,"Our host sat us and told us it was happy hour but didn't realize it was not 3pm (the time happy hour actually started). So we put an order for appetizers because they were half off for happy hour and asked our server for happy hour priced beers and she let us know it was not happy hour.  Long story short, they gave us the appetizers and beers for happy hour prices for the confusion of the happy hour time.   Our server was very sweet but was not very attentive to our table. I can tell that's he was hustling and bustling with her other 2 tables but her absence at our table made me feel like she was ignoring us assuming that we were only there for happy hour. We ordered our food (not from the happy hour menu). It came out at a decent time and was delicious. I ordered the shrimp scampi and Caesar salad from their lunch combos. Enjoyable!  The service could have been a lot more better but overall the visit was good and left with a satisfied stomach."
M D.,"Oceanside, CA",0,2,,4.0,1/9/2017,"Our experience started off great thanks to our sweet server Nessa. Very attentive and did I mention she was a sweetheart? Thanks girl! Me and my boyfriend were upset with your bartender Sofia (Sophia). She was being very loud and obnoxious. Not to mention she embarrassed a guest by yelling out saying  she was in the middle of something and couldn't get his table some waters. I felt bad for the guy and his date because even though  I wasn't by the bar, I heard her yelling at him and then yelling at a different server/busser to get the waters . The time it took her to yell, she could have been filling up the waters an satisfying her guest. Customer service is everything and she not only failed in that, she disturbed me and my boyfriend in a different section. Other than her everything else was great!"
Erik A.,"Oceanside, CA",75,4,,2.0,3/30/2017,"Went in to eat after a long day at work, needless to say I was starving. My family and I decided to go out to eat at Applebee's and enjoy our evening.. The first thing we see when we walk in is a sign saying  something about if you don't donate you're helping kill a baby..( I'll get to that)  anyway I ignore that as much as possible because I'm in a resturaunt I'm here to eat and enjoy myself not be foot tripped like that. So someone sat is down and as we waited for our food I see this lady walking around the store giving lil green custom made cards asking for donations and then outta nowhere she  popped up at my table and I honestly thought it was the waitress.. Seeing her and her baby along with her card for donations just didn't sit right with me and it looked like the manager was behind her barely removing her after she looked like she'd been there a good thirty minutes. I just felt bothered by the experience that's all."
Sindy P.,"Oceanside, CA",32,31,,2.0,7/31/2016,This location unfortunately is a hit or miss. Some days your food will be out on a timely manner and others it will take 45 minutes for a to go order. Just depends who's working I guess.
