Username,location,friend_count,review_count,photo_count,rating,date,review
Erica T.,"Charlottesville, VA",6,86,5,3.0,7/16/2016,"This was ok.  My husband, children and I ate there and we're happy with our meals. The kids meals had a good variety of options and both of mine enjoyed what they selected (corn dogs and spaghetti).  They also got the kids' pazookies which looked delicious!!  A value! My husband enjoyed his Mediterranean tacos and the 2 beers he tried. My salad (ahi tuna) was good but I had throbbing in my jaw afterward (my reaction to msg) so that was disappointing.  Skinny margarita was good. Our server was ok.  She seemed hurried (probably because it was a bust lunch time) and a couple of times I tried to order a 2nd drink but she walked away too quickly.  She also tried to take my salad away before I was done.   All in all, the kids liked it and they are far pickier than I!"
Phillip B.,"Richmond, VA",0,39,5,5.0,8/20/2017,Wanted the mahi mahi but I wanted to have a few different ingredients. Not a fan of peppers and onions. So they allowed me to pick different choices from the pizza ingredient menu. It's was awesome.  I told the server I had some mahi in the fridge at home and after the meal the cook came to my table and told me how she cooked the fish so I could try it.  I will keep coming back.  I also love the European beer choices
Haley B.,"Richmond, VA",0,1,,2.0,11/4/2017,"I had never been to a BJ's previously and I have to say i'm disappointed. My friend ordered a sirloin with asparagus and it was WAY too salty. I ordered a chicken sandwich with a caesar salad and it was ok. not the best. then i got a free dessert for joining their premier rewards, took 25 mins to get a small cookie and some ice cream. the service is poor and would not recommend. the only thing good about this place is the managers."
Krystle E.,"Glen Allen, VA",52,66,36,4.0,5/18/2017,"Never can go wrong at this spot. Every time I visit, the service and food are exceptional. With this visit there were about 15 of us. Although there were many of us, the service never lacked. The 2 servers we had were on top of it. We had many different entrees, and the kitchen made sure we all got them at the same time. Our cups were never empty and table stayed clean. I'll keep coming here as long as the service stays excellent. Oh, and they keep serving those pizookies! The salted caramel one to be exact ;)"
Tara H.,"Henrico, VA",94,168,393,5.0,6/12/2016,Thomas was great!! I tried the Mediterranean chicken tacos and the pizookie. Both were delicious. I usually get the same thing but glad I tried something different.
Leisa L.,"Pickerington, OH",55,2,3,5.0,8/11/2017,"Luke the manager was AMAZING. We had a minor hiccup with our call ahead seating. Luke bent over backwards to accommodate us. My main reason for going tonight was for my Mother's birthday and we chose this place because of one main dish, which was no longer on the menu. Luke had the kitchen make this dish anyway. Our waitress was equally amazing. I've only eaten at BJ's a handful of times but I will make this a regular spot now simply for the way Luke made us all feel!!! Thanks for my mom's bday dinner beinf awesome!!!!"
Jon B.,"Richmond, VA",184,220,192,4.0,4/1/2016,"On last Sunday I was on a mission to have lunch at a restaurant that I had not been to before. While on this mission, I came across BJ's Restaurant. I never even heard of the restaurant until about a week ago. But how did my experience go? To find out, read below.  The Good: Menu- From the looks of things, this restaurant is like Applebees on Steroids. Their menu focuses on sandwiches, burgers, chicken, ribs and pasta. The difference in a BJ's menu and an Applebees menu is the variety that BJ's offers. The menu itself has to be over 4 pages long. Those that are indecisive might take some time to make a selection but those looking for a specific taste in food will have a better chance finding it here than other restaurants that specialize in ""American Food"".  Price/Portion- I ordered the lunch special Chicken Tenders and Fries. Yes it was a safe choice in food, but the chicken tenders were around $7.50. This is a bargain considering that at other restaurants, their chicken tender meal is sold for around $10. The portion of the food was also pretty filling for the price paid.  Taste of My Meal- As stated before, I ordered the chicken tenders meal. The food was very good. The food came out hot and I did not need to add any seasoning to my fries. I could say that I was satisfied.  On the Fence: Service- The server was friendly and more than willing to accommodate any need of the table, but there were times when she disappeared for long periods and the food took longer than I thought it would take given the small number of people inside the restaurant.  Taste of the Root Beer Ribs- I had the chance to sample a rib from someone else that ordered the meal. The meat was a little tough and the seasoning was more of an acquired taste to me. It is definitely a dish that I would not order. Overall: If you are looking for a restaurant that has the Applebees on Steroids theme then this is it. The ambiance is great, food is affordable, portions are great and my group had overall positive reflections on how the food tasted. I could surely see myself coming back to this restaurant and I would be more than happy to sample other dishes on the menu aside from my favorite Chicken Tenders meal. FOUR STARS."
Myra Z.,"Rockwall, TX",0,7,,2.0,9/15/2017,"Food is fine , service not fine. Our waitress gave us attitude from the second we sat down. We asked if we could move to another table and she gave us a look and replied ""I don't know where you would even go "" (with more than half he restaurant empty, including the table right next to us which we chose). She rolled her eyes and seemed very impatient with us ordering. We got some dessert and that took forever coming out , that all the ice cream and whip was melted into soup, we didn't even touch it . When we asked about why it was sitting outside for so long she just mumbled something and walked away. But the manager did say we didn't have to pay for it."
Rodney M.,"Williamsburg, VA",28,8,1,1.0,3/9/2017,"First and last time. Wanted to try, because I heard some good things about this place. Glad ribs were on special, 2 of the six bones had no meat on them, but damn those bones were seasoned!  Clam chowder soup was below average with rubbery  chucks of clam, ( imitation clam maybe ). Salmon looked good when it came to the table until we compared the serving size to the menu picture, menu picture was larger. I'll always try anything once. This falls under that category. Sorry, first impression!"
Nur O.,"Alexandria, VA",52,1,,5.0,6/15/2017,"There's this one server, and let me tell you: he is the MOST attentive, polite, passionate, and hilarious server I've ever met. He takes pride in his work & it shows. He's definitely going places in life but in the meantime he's bringing smiles to those he serves. If you eat here, be on the look out for Holden. And if you have the honor of getting him, tip him well to show your gratitude. Plus, he's pretty easy on the eyes..."
B B.,"Indianapolis, IN",15,115,36,4.0,3/4/2017,"We have been coming here for several years I have always been very happy with overall quality, service, cleanliness and value so I haven't updated the review from one of my first visits.  I am dropping it a star based on my last 2 visits and if I based it on those alone I would only give it three stars and that may be a gift you a half a star.  The last 2 visits the food was average at best and the service was no more than 2 stars.  It seems that they have new employees all the time and the training for customer service has clearly dropped off as has the overall quality.  Last nights quality was a 2 at best service was longer than I am used to and the food temperature quality was poor.  The food wasn't hot it was warm deep dish pizza and baked ziti were just that warm which means it had been setting.  My quests is about 10 minutes just sad to see an above average to excellent place fall so short."
Iris M.,"Marietta, GA",14,44,60,4.0,3/29/2017,"Came to grab a late night bite to eat. Had the Santa Fe Salad, and it was really good. We haven't been dissatisfied when visiting BJ."
Tony C.,"Irvine, CA",242,366,763,5.0,10/1/2014,Harvest Hefeweizen.  Mediterranean Tacos.  Pumpkin Pizookie.  Done. So done. Hands down bomb dot com.  What an awesome place!
Alissa H.,"Collinsville, VA",8,2,,4.0,4/7/2017,Seating and services were prompt on a Thursday night. We sampled delicious beers on tap an enjoyed our burgers. The food arrived quickly and we followed with a dessert to share! The pizookie was amazing- so rich we didn't finish but it was very good. Our server was able to help splitting checks as I was traveling for business and need multiple receipts. She didn't hesitate to help with that. Payment was fast and easy.
Kitteesha S.,"Richmond, VA",35,7,30,4.0,4/20/2017,"If you're looking for a nice selection of appetizers, small plates, entrées, and the wonderful desert Pizookie at a moderate price this is the place you should try. My husband and I wanted an early dinner so we walked right inside where a not so polite server/waiter/host was on the phone. I thought he would acknowledge us however that didn't happen. Finally we were seated and thats when we Rebecca Y came along and sweetend the sour taste in our mouths. Not only was Rebecca bubbly and hosptalitable she recommended dishes and was attentive. We settle on the Garlic Parmesan one of Rebeccas favorites and they didnt disappoint. For our entrees we both got the Full Rack of Ribs special. That came with two sides, I had White Cheddar Potatoes and Roasted Brussel Sprouts. Husband enjoyed Asparagus & White Cheddar Potatoes. The special also included a house/cesar salad which complemented the wings perfectly. Our food came out in enough time so we wouldnt be forced to push food down our throat. We fined it out with the mini Pizookie. I had the Ghirardelli & husband enjoyed the White Macadamia Nut. The pizookie was warm and fresh. The ice cream was heavenly."
Christina R.,"Richmond, VA",23,86,72,4.0,12/15/2015,"I must admit, I hadn't heard of BJs until my fellow co workers recommended it as a place to have lunch. We were a group of 10 and were very quickly accommodated even tho we had not made reservations.  We ordered a plethora of food- everything from thin crust and deep pan pizzas, sandwiches, pastas and my favorite- ribs!  Everything was delicious. I'm giving this review 4 starts only because it took a loooong time to get our food- but nonetheless will be back again."
Charles B.,"Richmond, VA",64,103,240,4.0,9/20/2015,"Very nice atmosphere third time and have never been disappointed.  The service is great, plenty of seating so wait time is short even on a Saturday night.  The pizza and draft beer is what BJ'S is know for but there menu is huge, not quite Cheesecake factory huge but lots to choose from.  Plenty of beer and drink options. I had the BJ'S classic pizza and the medium and two salads filled us up."
