Username,location,friend_count,review_count,photo_count,rating,date,review
Sheila G.,"Las Vegas, NV",489,690,1218,3.0,1/10/2017,"Arrghhh, I hit a key accidentally and my almost-complete review disappeared!  To re-create: It was senile dementia that brought us to the Cheesecake Factory.  Let me explain: Friends were visiting from CA, and after we sat around drinking wine and munching on cheese and crackers, we turned to the serious problem of where to go for dinner.  The couple has been to Vegas often, but mostly in the SW valley, where their son lives.  Herb came up with the brilliant suggestion to go to Mixx, and I readily agreed, thinking it would be something different for them. We were presented with menus and water, and as I was explaining the bowl concept to them, I suddenly had a Duh! moment, and realized that the very next night we were going to meet a group of neighbors for Happy Hour in this very restaurant.  We had already decided that at HH we'd order two Fresh Market big bowls instead of the HH apps, so that we could take home leftovers, my favorite meal.  But we didn't remember any of that when we set out for Mixx.  We certainly weren't going to do that two nights in a row.  So, completely chagrined, we told the waitress we'd see her tomorrow night.  Cheesecake Factory, being right next door, was the obvious substitute, since we didn't want to start thinking all over again. All four of us ordered from the Skinnylicious menu, probably in atonement for the excesses of Thanksgiving, Christmas and New Year's.  Our friend had the Flatbread with Pear and Blue Cheese, and loved it.  His wife had the Lettuce Wraps, picking the Asian ""tacos.""  The dish looked beautiful, and she enjoyed it. My husband ordered a Turkey and Avocado sandwich, which came on a bun with a bowl of salad, and he liked his, too. And then there was me, deciding on the skinny version of the Turkey Burger. Wanting a change from buns, I chose the wheat baguette. And ranch on the side for my salad.  As soon as my fork touched the burger, it fell apart, but it tasted okay.  But that wheat baguette was no wheat baguette.  It was more like pumpernickel, and it was SWEET!  So were the caramelized onions - adding sugar is a sloppy shortcut for the slow cooking that renders them naturally sweet.  My salad didn't come with the ranch dressing I asked for.  Instead, it had the house dressing already on it.  Lots of it.  When the waiter brought a new salad and the ranch, that dressing turned out to be strangely sweet, too.  Sweet ranch??? Yuk, and yuk also for the salad, which was a sizable portion, but completely different from the one my husband got.  Not my kind of mix. Service was impersonally okay, but just average.  Three of us four liked what we ordered.  I'm the outlier, but I'm the one writing the review, so I get to give it three stars.  And I'm being generous."
Angelo C.,"Las Vegas, NV",0,2,1,5.0,12/29/2017,"A few weeks ago, I came here for the first time and thought it was amazing. Most places give you a tiny personal pizza and you end up still hungry. Because of this, I ordered a personal pizza and chicken tenders. I was wrong and a big, still warm pizza came with large chicken tenders and fries. I ended up having to take most of it home. The wait for our food was a bit long but we had delicious bread at our table along with butter. 10/10 would go there again."
Mel B.,"Las Vegas, NV",155,115,282,4.0,11/22/2016,Not my first time at this location: service is always very knowledgeable (their menu is a novel)  The server was very busy when we got there so he created us and said he would be right back. Got our drinks and then let us decide.  We ordered the artichoke crab dip (came out hot) but it wAs a tad too fishy.  I definitely think the wine prices are WAY too high for the name brand they are selling. We spent $50 in drinks and only had two a piece. We both ordered the ribeye and was cooked perfect!! I always get their grilled asparagus (fantastic) instead of green beans.  UP charge btw The bread basket they give u is also fresh and warm.  So full at the end I had to take cake home. We will be back but not soon. Just so pricey for two.
Jenna T.,"Las Vegas, NV",167,74,120,5.0,4/24/2017,"We like to come to Cheese Cake Factory on our cheat days. Nothing better than enjoying a large portion entree and a sweet cheesecake for dinner.   Today we came in and were served by Isaiah. What an amazing server! He was very energetic and paid attention to small details that separate good servers from superior servers. The service staff here at the Boca Park location is 90% great but today was extraordinary. Even after our server got sat another table after us and a party of 10 at the same time, our experience was never sacrificed. Our drinks were never empty, our order came out prompt and we were never in need of anything.  Tonight we ordered iced green tea with mint, the chicken marsala and chipotle chicken pasta but we substituted the pasta for mashed potatoes. And for dessert we shared a lemon, strawberry cheesecake.  Chicken marsala is 2 thin pieces of chicken in a homemade marsala sauce with a generous portion of mushrooms. This is served on a bed of bow tie pasta. The chipotle chicken pasta is a flavorful dish with asparagus, peas and chicken in a warm chipotle sauce. It's not spicy and does not lack in flavor. The portion of chicken is on the lighter side though. All entrees are served with both sourdough and wheat bread with butter at the beginning of your meal too. There are so many desserts to choose from but tonight we went with one on the fruity side. It wasn't too sweet or too tart. I was actually surprised how balanced the flavors were."
John Y.,"Las Vegas, NV",59,45,43,1.0,6/18/2017,"So I assumed since I had a such a bad experience about one month ago I wrote a review. However, i must not of.  Let's start with my little brother's girlfriends graduation dinner from UNLV. A party of 8, service was good, the server was attentive and had everything going for her when it came to her tables.  The food, well, how can you mess up a burger medium? It can be done, and I was done this night.  As they were swamped, I knew better than to ask for a remake, it would have taken them one hour for a burger.  No worries the dessert made up for the crappy food.  Now today, 6/18, as it was not my choice to go, I went back because my brother's girlfriend loves it there. Issac was our server, really good server, but the length of time to get two basic meals was not good. I did not order as I got there late, and my brother was waiting 1 hour for tacos and some other quick making food.  The patrons to the side of us, who came in after him and right before I,  received their food beforehand. As both my brother and I come from a hospitality owned establishment, this is not what we excepted.  This is not the normal Cheesecake Factory expectations, at least from the east coast. I know I will not be returning to this one ever again. Furthermore, I will make sure no one visits this one when they come to visit."
Nene N.,"Las Vegas, NV",345,51,280,4.0,9/1/2017,"Godiva Chocolate cake. Nuff sed. I eat here a lot and every single time, I MUST HAVE the cake!"
John M.,"Las Vegas, NV",0,20,103,1.0,10/1/2017,"It's hard to believe that a company as large & well known as Cheesecake Factory would allow their restaurants to be Deceitful, Dishonest and Cheat their loyal customers!  See my posted photo of receipt from my last visit to Cheesecake Factory, Boca Park location. Though it's only a suggested gratuity, they Deceitfully suggest you tip on the taxed amount. Almost every other restaurants I visit only suggest tip on actual food & beverages as it's supposed to be. I usually tip 22 - 25% of amount & sometimes glance at these numbers to help determine my tipping amount. I noticed this before but now have to speak out because of continued use of this misleading practice. If this happens to you Yelpers at other Cheesecake locations, please post a review to warn others of the Dishonest Billing practice being used by Cheesecake Factory! 5 Stars for Food 4.5 Stars for Service ""0"" Stars for Billing Practice"
Christine P.,"Las Vegas, NV",186,95,640,2.0,3/16/2017,"We went by last night to give this location another try and it was not a good experience, in fact it was worse. I handed our waiter, David N., the letter which still had the gift card attached to it (you guys sent us a $45 gift card to give you another try). In the letter it states that the manager would like to know we are there and they could make sure our experience was a better one and would like to meet us. This did not happen, the waiter stood there and read the letter so I don't know if it was waiter who did not inform management or they just didn't want to come out, but we were never approached by any manager.   We ordered the eggroll sampler and it was just put in front of us with no explanation of the sauces (never have we ordered any of the eggrolls). We had to go back through the menu to read the individual eggroll descriptions to try and figure this out the sauces but I still don't think we got it right. Now, of course this isn't the biggest deal so we just let it go.  My friend ordered the grilled fish tacos with no marinated onions and instead cooked onions with no chipotle sauce (she's very sensitive to heat) and to have that replaced with your creama (from the ""slim"" menu). She received her dinner and there was no creama, just chipIotle sauce, a very minimal amount of grilled onions (a taco had ONE small strip) ZERO avocado (as it states on the menu its served with it)  and somehow there was a pickled cabbage?? (it's not stated thats on the tacos on the menu) We asked the server if they could remake it and at this point we are getting very frustrated with the service and food. I had to ask for my coke and her water to be refilled MANY times despite the waiter always walking around. I was genuinely flabbergasted I had to ask for refills with how much he was walking by.  So, by now, after already a long wait to receive our food to begin with (the restaurant was not busy by any means from what we could tell) we had to wait another 15 minutes for her food to be remade, so my boyfriend and I stopped eating out of courtesy.  45 mins after we ordered our food, we FINALLY got to eat together and of course my boyfriends and I's dinner was cold. My friend STILL then had a problem with her order (the tortillas were not cooked) but by then we were so hungry we didnt say anything.  Now, here comes the time to pay. After the waiter took the $45 gift card off the total, the remaining balance of the bill was $42 and change. I only had twenties and my friend had her debit card. So, we told the waiter for $20.00 on the card and I put down two twenty dollar bills. David, our waiter, brought back the receipts with no change! Never EVER had I had a waiter just assume the remaining change was theirs and pocket my cash. He never asked if we needed change to verify it was his, he just took it! I asked for it back and he mumbled an apology about be busy or whatnot (which none of us believed, he was making excuses all night and the place WASN'T busy).  For this trying to be a make-up from last time for the burnt food and bad food, you guys SERIOUSLY missed again. I don't know if it's this location or whatever but we are very unsatisfied with the service and food and that the manager wasn't around to make sure our dining experience was better than the last. I really enjoyed you guys, but at this rate my friend says she NEVER wants to come back and I don't blame her!!!"
Kristin B.,"Las Vegas, NV",2,21,1,5.0,12/4/2017,I came here with my friends and it didn't take long to get seated. I love their extensive menu. I ordered a flatbread off the Skinnylicious menu and it was delicious! Dessert was great as well. Our server was fantastic. Great service and great food - I highly recommend this location.
Danette W.,"Scottsdale, AZ",108,181,301,4.0,4/14/2017,"The Cheesecake Factory has an awesome happy hour. The menu is limited which is usually the case for happy hour but the choices are really good. Oh and the drinks....Really good. There were three of us so we decided we'd order three appetizers between us. We got cheeseburger sliders, nachos, and Vietnamese shrimp spring rolls. Everything was delicious and our waitress also brought us out the signature bread and butter. So good. For drinks we had mojitos and Long Island ice teas. Both delicious. Atmosphere is great. I love your happy hour Cheesecake Factory. Thanks for a great experience."
Michelle T.,"Salt Lake City, UT",5,52,34,4.0,4/10/2017,What a wonderful dining experience  here and our server was great. Unfortunately my meal was just subpar. I had ordered fish & chips and the fish was soggy wish they were crunchier... my birthday cheesecake was AWESOME!!
Dante F.,"North Las Vegas, NV",233,48,,5.0,8/16/2017,"I use to work at Boca Park and never ate here, but recently I decided to give it a try... several times.  The bacon truffle cheese sticks are in my order every single time. I've tried a couple of different burgers. All were seasoned very well and cooked perfectly. Their cheesecake is great, but the best option is the Oreo cheesecake.  I ordered delivery so I'm not sure what it's like inside of the restaurant, but I'm sure the food is probably even better without the long ride for delivery."
Chris I.,"Hot Springs National Park, AR",16,86,430,3.0,1/26/2017,"Food here is always delicious. I got two different types of cakes and the red velvet cheesecake. It was delicious. However, servers behind the counter ignored me while they were gossiping on the other side of the counter. I almost left had it not been for my parents. It was very rude that they kept me waiting while there were three servers on the other side just talking their heads off. With this hopefully they would be more attentive to customers!"
Claude R.,"Las Vegas, NV",4,100,17,1.0,7/30/2017,We went for lunch yesterday and it was truly a disappointing experience.  I had a lunch portion of one of the pastas. There was three small pieces of chicken over powered by the mushrooms which tasted a little burnt.  The lunch portion appears to be around half the size for almost the full price. The portion size wasn't an issue since the food was not palatable. It wasn't a good value at all.  My wife got a salad off the new light menu and it was basically just lots of lettuce.  Service was slow. We had to ask for refills many times and were never offered a refill unless we asked.
Heavenor H.,"Henderson, NV",4,4,2,5.0,11/7/2017,Happy hour here is hands down the best Happy Hour during the week!!! My top three appetizers are the Buffalo Blasts which is a best kept secret at this restaurant! Avocado egg rolls are great to share but I've been known to keep these all to myself and last but not least the Sweet Corn Tamale Cakes!
Jerry Y.,"Las Vegas, NV",16,2,1,2.0,8/28/2017,Ordered a well done classic burger  made it clear when I ordered I wanted it well done. I said actually very well done. Server said no problem.  Not even close to well done. Told her about. No refund no offer to redo it. Very poor experience will not return
