Username,location,friend_count,review_count,photo_count,rating,date,review
Ebie B.,"Chevy Chase, United States",170,86,2,2.0,16/2/2016,"Cheesecake Factory- where everyone is confused, all the time, always. I honestly think they use the shock value of huge portions to distract you from mediocre food punctuated by the mostly wtf service. But a huge plate of greasy fish is still greasy fish. Most recently I went here to pick up a to-go order on Sunday. Yes it was Valentines Day, but I have never experienced a more chaotic mixture of overwhelmed staff, poor planning and horrible time management, even on New Years Eve. There were many tables open that the staff seemed unaware of and I heard a lot of complaining from patrons about the wait.  So I go to pick up my order. There is a huge line. It is slowly merging with another line. No one seems to know where either of these lines lead. I didn't know if I was waiting in a line to pick up food or get a table. Neither did the people in front of me. Finally a staff member assured me I was in the correct line and that although the line was long, they had 2 registers open so it should be moving quickly. Lies. They DID have both open but only 1 was in use. The other served as a prop for one of the employees to stand in front of, doing nothing. In the entire 17 decades I was in line for, I saw her pick up 1 paper bag, put it in the fridge and then continue to stand there. The same line is for people placing an order as it is for picking one up, which makes no sense. I finally get my food. It ranged from lukewarm and greasy to just plain cold. Some of the fish was almost inedible. $20 wasted. Thanks guys.  The restaurant itself looks very nice. It's kind of small and very cramped inside. Outside there is a nice little roped off area inside the mall with stellar views of the Foot Reflexology place. They have made the best use possible of the space outside, and it really looks quite nice. However I'm not inclined to go back anytime soon. A hugely frustrating experience capped off by cold food and ineffective staff does not scream ""quality dining""."
Scott L.,"Buffalo, United States",56,190,291,4.0,7/6/2016,"My friend pick the place, it is located in the mall, and they have the valet parking in the front.  I have been to Cheesecake Factory many times in Chicago and Buffalo, this store is no different than others. Food is good, cheese cake is great. I had ribeye, and tiramisu as my dessert, which get me all filled up.  Service is adequate. They do have a seating area next to the hallway, which could be nice as inside sometimes could be noisy."
Frank K.,"Washington, DC, United States",120,209,173,3.0,30/11/2016,"Cheesecake Factory. You know what it is. I don't even remember what I got because it was pretty forgettable honestly, but I have to say the cheesecakes are great. I got the lemon meringue, and it was delicious."
Oscar S.,"Silver Spring, United States",140,1,,3.0,1/1/2017,"The location is very convenient, very easy to locate. Parking is abundant! The food took a very long time to receive."
Arthita G.,"Hyattsville, United States",199,161,365,4.0,27/6/2014,"The portions are huge! Literally HUGE! We went there as a big group of nearly 20 people and they could accommodate us all comfortably.  I ordered mexican tortilla salad from the skinnylicious menu, frozen iced mango smoothie and godiva chocolate cheesecake. The salad was quite nice. Smoothie - not bad although I couldn't finish it. The cheesecake was good but it tasted too much of chocolate and very little of cheese. My suggestion is to order tiramisu cheesecake instead. It tastes better. The place was nicely decorated and I had a good experience with the service too."
Kevin D.,"Rockville, United States",9,116,231,4.0,22/5/2015,"I visited (4/28/15) ordered Southern Catfish Dinner w/mashed potatoes, corn & string beans. Meal arrived @table piping hot! The catfish fresh flavor, fish costing is crispy lightly seasoned. The corn & beans crisp fresh taste, chunky style mashed potatoes. Delicious meal. Great service."
William P.,"Bethesda, United States",40,15,,2.0,4/6/2017,"I normally like Cheesecake Factory. My usual order is the Ribeye which has been pretty good. This time around I decided to try the California Cheesesteak. This was a HUGE mistake.  It may as well have been called a Cheesefat since there was more fat than steak in the sandwich. It was just bread, fat, cheese and veggies. Perhaps it's bc it was Uber eats and they figured the quality could be crap since I couldn't call the manager over.  So I decided to add this yelp review instead. If you ever have the urge to order the Cheesesteak, think again and relook at the menu."
Patrick M.,"Potomac, United States",0,10,,5.0,28/6/2017,I just went there for my birthday my server was very kind gave her a 20% tip for doing a god job and if you are shopping at old navy witch is right down the hall from it if your shopping for close and want to get something easy go there
Ronald P.,"Silver Spring, United States",84,4,5,2.0,27/11/2016,"Not the best experience... food took almost 40 minutes to arrive , server didn't even ask if everything was fine or if we needed anything else after food was served , food it was okay , the chicken teriyaki was very plain , chicken and shrimp Cajun it was ehh barely had like 3-4 shrimps .. not my first choice next time I want to go out to eat ..."
Kristene S.,"Washington, DC, United States",34,4,,1.0,22/7/2016,This location needs to be closed. Most people go to cheesecake factory for the huge portions as well as selection. This location gives bland food and kid sized portions. I used to be able to eat my left overs for 3 separate meals. I don't know what's going on. Cheesecake used to be my favorite restaurant but I will never go here again.
Sarah C.,"Bethesda, United States",163,385,2172,3.0,12/1/2014,"5 stars for our server I liked her a lot (mimicking Lloyd Christmas) And if you know who he is, you're cool~ Right amount of personability and sense of humor (hi) Westfield Montgomery Mall is Cheesecake's new home Offering their customary valet parking Sunday brunch with the better half Before the playoffs - didn't want to stray too far He wanted something sweet yet still breakfasty/brunchy   Goodness.....Elvis style Belgian waffles??? 4realz? K. He's jogging later so no harm no foul  Everything you can imagine the King would eat in one sitting Displays before you on a plate Even our server agreed this was plenty Apparently some returned the dish due to the overmuch He enjoyed it and left about 2 slices The boy has a fondness for peanut butter My Eggs Benedict had the usual Canadian bacon with H sauce Plus with the option of spinach and tomatoes Yes I said to those But the poor potatoes - they're still learning I guess Baby it's cold outside so their hot tea was necessary The Art of Tea Noa blend (black tea) paired well  It's a habit not to add anything in my hot tea Especially when coupling with a meal This new address will be bustling when the weather improves"
