Username,location,friend_count,review_count,photo_count,rating,date,review
Mike K.,"Hickory Withe, TN",2,99,55,3.0,7/27/2016,"Good:  Seated in a reasonable amount of time on a Saturday night, simply superb hamburger sliders as an appetizer, incredibly good Kahlua Cocoa Coffee Cheesecake (and I'm not usually wild about cheesecake), friendly server and a nice interior.   Not so good:  average shrimp, average chicken and average salmon; slow service; can't-have-a-conversation-loud and somewhat pricey. Tip:  the menu is ambitious - peruse it ahead of time."
Shelby B.,"Memphis, TN",0,3,1,5.0,8/14/2017,"Had a gift card that I needed to use, so I stopped in this evening for dinner. Service was excellent. My servers' name was Hailey (sp?) and she was excellent! She knew I was having dinner by myself, so she gave me space but was very attentive. My drink glass was never empty, which was a first for me at this restaurant. I started with the spinach and cheese dip and my main course was the Ribeye steak. The appetizer was good, a little on the room temperature side instead of hot like I would have preferred, but the flavor was delightful. My Ribeye I ordered Rare and it was cooked perfectly, very juicy and tender. Will definitely be back to see this server again!"
Amanda S.,"Memphis, TN",3,36,55,4.0,1/27/2017,"Wait time is usually crazy long ... But the food is good (but a little on the expensive side). We typically go here to eat for ""special occasions"" haha. Very friendly staff and great atmosphere. I personally recommend the Chicken Madeira entree - Delish!! (posted a photo of it)"
Samantha B.,"Collierville, TN",217,763,2516,4.0,9/27/2015,"I adore the location in Nashville so I knew I had to try this one as well for my birthday and my parents' anniversary (we double up celebrations a lot lol). I will admit we had the same problems as other people with the slow service, but hopefully that fixes itself over the next year so when I return it's still amazing. I did enjoy them singing for us and I'm glad we got two pieces of cheesecake at the end so they could decorate our plates with our different celebrations. :) So much fun!  Ok, so something new I realized about this place for me: they do strong flavors really really well but muted flavors not so much. For example, the flavor-laden dish hubby got was as good as it is in the other location whereas the simpler dishes my parents and I opted for were either bland or just ok. I will have to definitely stick to strong flavors here, though that's no problem for me since I usually sway that way anyway.  I thought I heard the strawberry shortcake won some kind of award for best dessert but me and my family were not impressed. I really liked the eggroll sampler as I got to find my favorite sauces and eggrolls. We were surprised the chilaquiles here were just not that great. Chilaquiles tend to taste awesome at restaurants but these were just meh. I did find my new fav cheesecake in the chocolate hazelnut crunch.  We will definitely give them another shot next year, but if it's like being on Hell's Kitchen (which is what Dad compared it to because of the long wait to get our food) then hubbs and I will just stick to going to the Nashville location.  To Try:  - Adam's PB Cup Fudge Ripple - Snickers Bar Chunks and Cheesecake - Mango Key Lime Cheesecake - Reese's PB Chocolate Cake Cheesecake - Tiramisu Cheesecake - Key lime Cheesecake - Cajun Jambalaya Pasta  fav meal with angel hair pasta and double sauce Loved: - 30th Anniversary Chocolate Cake Cheesecake - Avocado Cream (eggroll sauce)  - Avocado Eggroll - Caramel Cheesecake - Chocolate Hazelnut Crunch Cheesecake  - Dulce de Leche Hot Chocolate - Oreo Shake - Samosas - Spicy Chicken Chipotle Pasta (Penne) - Strawberry Lemonade  - Tamarind-Cashew (eggroll sauce) - Tex Mex Eggroll - Wheatbread  Like:  - Bang-Bang Chicken and Shrimp (Chicken only) - Eggroll Sampler - Pumpkin Cheesecake - Spicy Chicken Chipotle Pasta (Angel Hair) hubby fav - Stuffed Mushrooms Ok: - Chicken Bellagio - Dulce de Leche Cheesecake - Factory Nachos - Factory Peach Bellini - Firecracker Salmon Eggroll  - Fresh Basil, Tomato, and Cheese Flatbread  - Frozen Iced Mango - Green Chilaquiles with Carnitas and Eggs - Miso-glazed Salmon - Sweet Hot Chili Sauce (eggroll sauce) - Toasted Marshmallow S'mores Galore Cheesecake - Veggie Burger - Warm Apple Crisp Nah:  - Bistro's Shrimp Pasta - Chocolate Mousse Cheesecake (Joel liked) - Chocolate Tuxedo Cream Cheesecake - Crispy Cuban Eggroll - Cucumber Lemonaid - Fresh Strawberry Shortcake - Guacamole (Mild) - Portabella, Avocado, and Zucchini Fries - Strawberry Fruit Smoothie - Tomato Basil with Pasta (chicken) - Turlte Pecan Cheesecake"
Lauren C.,"Memphis, TN",107,195,619,4.0,9/18/2016,"There are many downsides to dining at Cheesecake Factory Memphis, but there is apparently one huge upside. The Americana BURGER! Today is national cheeseburger day and boy did I celebrate!  I have never been so pleasantly surprised with a quality burger in my life. I forgot to order the burger medium and it still came out the most gorgeous shade of pink. The grilled flavor was also a delicious surprise! The potato crisps added the crunch and the grilled onions added the flavor. It was a big mess of a thing, but for the flavor - I will forgo tidiness.  There are headaches: The crowd, the book of a menu to sort through, the crowd.  The prices can be outrageous, but you get two meals in one basically. The shrimp platter is enough for three meals! The kid's pizza is large enough for an adult. If you invest on a meal you can heat up leftovers of, it's money well spent.  (Next time I'm sitting outside to get decent photos.)"
Michaela B.,"Searcy, AR",0,1,1,5.0,6/2/2017,I ordered Baja chicken tacos and they were amazing. They came with the best lime rice I have ever had! Awesome service! Loved how much guacamole came on each taco. Great portion sizes!
Eliana M.,"Collierville, TN",18,23,19,5.0,12/23/2016,Always a good choice when you can't decide what to eat. The Sunday brunch is amazing especially the brûlée French toast!
Brittany S.,"Cordova, Cordova, TN",0,6,,2.0,10/7/2017,I love the cheesecake factory just not this location. The food is just not cooked well compared to others i have tried up north. The service is questionable and i feel like the prices could be spared based on the fact this is just not a very good representation of the cheesecake factory
Phillip S.,"Memphis, TN",34,78,112,2.0,1/17/2016,"I just wanted to write about the atrocious experience I had at Cheesecake Factory at the Wolfchase Galleria in Memphis.  We arrived at 4:30 pm (you know, to beat the dinner rush) on a Saturday, and were quoted a 55-70 min wait!  That in itself is ridiculous and is a testament that Cheesecake Factory made this location way too small for the size of city that Memphis is.  The decision to not build a larger, stand alone restaurant is down right head scratching.  I've eaten at many different Cheesecake Factories and this is by far the smallest and most cramped.  Absolutely appalling for the size of city Memphis is.   After waiting past our 70 minute quoted time (80 minutes to be seated actually), my party of 5 was then squished into a booth clearly only meant for 4 people max!  One of my party members had to sit at the end in a chair.  I complained to our waitress who brought over this completely monotone, bullcrap answer giving ""manager"".  There was a much larger booth right behind us that was empty that they wouldn't move us to.  There were much larger booths around us that had only parties of 5 as well!  At this point we were so frustrated with the wait that we just wanted to order.   After our appetizers came out, we noticed we didn't even have any napkins.  In fact, when we sat down all we had were a few forks sat next to small plates.  But no napkins or other silverware.  We brought this to the attention of our waitress.....she never did return in a timely manner with napkins, as our hands were gunked with food from the appetizers.  We had to end up stealing the napkins at the empty booth behind us.   Then our meals came out.....we still didn't have a full complement of silverware, so we had to ask for a knife so my friend could cut her steak.  Then my son's spaghetti order came out wrong, and instead they brought out some type of other shaped pasta.  This got my son highly upset and he started bursting into tears.   As I've stated earlier, I've eaten at many different cheesecake factories around the country, and this was the only time I've ever had an atrocious experience.  All the food we ate was good, so I won't fault the restaurant on that, but the customer experience at this Memphis location is severely lacking.  This restaurant needed to be bigger....it's clearly overwhelmed by the popularity, and the staff clearly can't handle the crowds without customer service being in the tank!  Considering it's a 40 minute drive for us from where we live to go to this Cheesecake Factory, I can't say I'm clamoring to come back anytime soon."
Ericka C.,"Arlington, TN",1,6,37,3.0,6/16/2017,"Sooooo.... It's rare that Cheesecake Factory Memphis gets it right and tonight was no exception.  The kids quesadilla and Alfredo pasta were both good per my daughters. We ordered the calamari as an appetizer which was heavily breaded and greasy and stuck together. My advice to you is to never order this dish. We've tried it twice and got the same result each time. My husband and I both ordered the bone in New York strip cooked medium. The manager came out after several minutes and told us it would be longer than usual because one of the steaks were overcooked but offered to still bring the overcooked steak while we waited on the medium steak. We opted to wait instead. My New York strip finally arrived and it was cooked medium well but NOT medium but quite flavorful. The mash potatoes were lukewarm per usual but the green beans were great. Then about 15 minutes later my husband's steak came out and it was a ribeye instead of the New York strip  that we ordered but he didn't complain. He said it was flavorful but his mashed potatoes were lukewarm as well but the green beans were good. We also ordered Long Island ice teas which were perfection! We would definitely get those again. Lastly, we ordered our cheesecakes to go, one vanilla bean and one banana. The vanilla bean is excellent and it's my go to Cheesecake because I don't like very rich deserts and this Cheesecake has a nice balance. The same goes for my husband's banana cheesecake, it was great! Same thing, very good and not too rich! Overall food was good, service was ok and we will return. I took off two stars for the service and the calamari."
Dana W.,"Monticello, AR",5,145,11,4.0,9/4/2017,"My husband and I decided to venture out to the Galleria to try the Cheesecake Factory during our recent visit to Memphis. We have never eaten at one before. I know, unbelievable right? We normally avoid chains on vacation and stick to local food. I had the bacon truffle grilled cheese and he had the Riesling chicken (which is what I really wanted, but you have to save room for Cheesecake). His was better than mine, but they were both good. The grilled cheese was messy and a little tough to bite into, but still tasty. After we ate the obligatory meal, it was Cheesecake time! I ordered the celebration Cheesecake and he had the lemon meringue. Both were good but the celebration cake was better. The layer of strawberry mousse was the best part. I couldn't eat it all because it was huge, so my husband got to eat my leftovers later in our hotel room. I would definitely recommend the celebration Cheesecake for anyone who likes cake, Cheesecake, mousse and cream cheese icing. It doesn't get much better than that combination! (I could do without the crunchy sprinkles though)"
Jonathan N.,"Memphis, TN",0,2,,1.0,11/25/2017,"Tonight my wife and I went to The Cheescake Factory with our 14 year old daughter and her friend. We were seated quickly and the server was very attentive. We received our drinks and bread/appetizer pretty quick. We ordered our food and about 30 minutes later the server came to verify our order because the computer crashed. After an hour some of the food came out but not all. We asked where the rest was and were told it was coming. The ones with food patiently waited without eating to be polite. Twenty minutes later the rest came out and our food was cold. The manager apologized and offered us all cheesecake. He said it was the least he could do. However when the server came he informed us that the manager had only agreed to 2 pieces. I told him that all 4 of us had been inconvenienced. He said he would ask the manager to agree to a piece for each of us. He came back to inform me that the manager refused. It wasn't the fact that we were only getting 2 pieces of cheesecake. It was that after our food was extremely late and cold, the manager was not even sincerely sorry for our bad experience. He really didn't care that our food was cold and very late. The Cheescake Factory doesn't need to make every customer feel valued. I guess they have more customers than they need and can treat some badly and get away with it."
Jody W.,"Gansevoort, NY",135,643,1575,3.0,4/4/2016,"This review is based on take-out for about 10 people...can't speak to the sit-down dining experience at this location. Everyone enjoyed what they had - I ordered the ""skinnylicous"" shrimp summer rolls. They're only 410 calories and I wasn't terribly hungry - so they were just the right amount of food.  They did bring a piece of chocolate cake and a slice of caramel cheesecake. I tasted both:  The cheesecake was OK...not as dense as I prefer...the chocolate layer cake was really good. Instant diabetes on a plate.  I'm glad to see that they have lower calorie options these days on that ""skinnylicous"" menu (as it has been quite a while since I have been to a CF). Good to know."
Gerald M.,"Farmington, MN",27,7,,1.0,1/10/2017,"I am writing this review as the Lady at the counter is visibly unhappy i made a change in the size of the cheesecake i ordered. They did not have the 6"" on display so when they brought it out i had to switch to a 7"" cake. Cheesecake factory is a franchise restaurant and is one of the more desirable and consistent menus available at every location. Service is much to be desired especially when you politely apologize for the change and receive an answer of ""what do you want"" and clank away with utensils to show how disgruntled she was with the change. Oh well we still got the cheesecake for my kids but its just unfortunate they had to witness and hear the unprofessional service. I still will buy because its my kids favorite cheesecake."
