Username,location,friend_count,review_count,photo_count,rating,date,review
Stefanie P.,"Surprise, AZ",51,114,157,4.0,10/22/2016,"We've been here many times over the years. I like the large selection of food to choose from. Salads, burgers, pasta, tacos, burritos, sandwiches, meatloaf, Indian inspired... pretty much anyone should be able to find something here. A lite menu that is extensive and vegetarian options. I love the ""bang bang chicken and shrimp"" (chicken, shrimp and veggies in a delicious peanut sauce topped with rice and toasted coconut), their burgers and ceasar salad with grilled salmon. They have a salad with a wide variety of julienne cut veggies that is really good. I've had chicken tacos and have been pleased. I can't think that I've ever been unhappy with my meal there. My kids and husband are always happy too. To drink, I like the iced green tea with mint leaves. Ok, the important part... CHEESECAKE! My personal favorites are the Oreo cheesecake and the Adam's Favorite (a delicious peanut butter and chocolate fudge cheesecake). I've also had the pumpkin pecan cheesecake  (the crust is too hard, we got this on our last visit and weren't impressed), red velvet cheesecake, carrot cake cheesecake, white chocolate raspberry... probably others too. I mean, it's cheesecake, how bad can it be? Usually the cheesecake does not disappoint.  The service can be hit or miss. We are usually happy, but last night our server just really didn't seem like he wanted to be there and we didn't get great service because of it. Also, I don't like when we are seated at a small table adjacent to other tables (one side shares a long booth type bench), I feel that it lacks privacy because we can hear everything that is being discussed by the parties on either side of us. It's distracting. Not ideal for our ""date night"" which we don't get very often."
Paula E.,"Phoenix, AZ",222,598,1189,5.0,3/28/2017,What's not to love about the Cheesecake Factory? With their menu of choices under 550 calories everyone can find something to love. And who doesn't enjoy cheesecake. Our server was delightful and the meal well paced. A bit pricey depending on what you get but worth it.
Anaiss R.,"Phoenix, AZ",0,3,1,1.0,12/31/2017,"Came here last night to celebrate a loved ones birthday, we had a party of 7 adults 1 child. The lobby was very packed with guests waiting to be seated so we knew it would be a bit of a wait but we ended up waiting to be seated for over an hour and a half. We saw families that arrived after us dine and leave even before we were seated. Food and service from waitress was good, once we were done with our meals we asked to speak to a manager. Matt came over to talk to us and as we expressed how upset we were over the waiting time he, instead of being apologetic, was very argumentative and defensive saying how that is ""normal"" for large parties. All we were hoping for was for a sincere apology since the hostess manager Brad failed to do so and to top it off didn't even seem to care that we were standing there waiting that whole time. As we were leaving three hours after arriving Brad walked past us and all he did was look at us and looked at his watch, that could of been his second opportunity to apologize for the wait time but he didn't. If you plan to come here with a large party please take your business elsewhere or be prepared to wait a long time without even being acknowledged that you're there. Will not be coming to this cheesecake factory again."
Dana J.,"Surprise, AZ",0,14,3,2.0,10/22/2017,"Last time I came here I was not happy I was told I could seat any where in the bar area so me and my husband did thAn we were ask to move cause the seats on the wall in the BAR area are regular seats I guess no one said that so we went and sat at the bar I ask for a lemon drop Martini and they suck too the bartender that really can't speak English suck on making a lemon drop Martini sad part we order total of 4 drinks and one Appetizer and our bill was 85 never again will I go back they suck too ,charge too much money and can't get my drink right"
S A J.,"Phoenix, AZ",1,2,1,2.0,7/12/2017,Very slow service. Made us late for an appointment. It would have been nice to know why the service was so slow prior to requesting to speak with the manager.  The turkey burger was juicy but lacked flavor
Jez D.,"Deer Valley Village, Phoenix, AZ",0,4,,1.0,10/18/2017,"I typically love The Cheesecake Factory, but lately their service is terrible. Last Saturday my husband and I ate there around 9pm. We had a nice, older, dark haired lady as our server. She was friendly, but absolutely clueless. First sge brought out loaded potato soup and forgot the bacon. We waited 10 minutes for the bacon and the soup was cold. Then I had a bbq burger and she forgot the sweet potato fries, so I was left to wait 10 minutes for fries and by then my husband had finished his catfish. Needless to say, I ate alone while my husband waited for me to eat. This all happened after already waiting 30 minutes for our food, even though the place was dead! The only positive things I can say is that I enjoyed the Strawberry Creamsicle and potato soup. This restaurant is too overpriced for the lack of good customer service."
Domo H.,"Phoenix, AZ",126,45,81,4.0,7/7/2017,"We've been to this location several times in the last two years. It is pretty inconsistent. Sometimes it's amazing, usually it's pretty good, and other times we walk away wondering if we'll be back. Tonight was a pretty good night. We were seated pretty quickly and our waitress came right up to the table and got our drinks started and asked if we wanted bread. A few minutes later she brought water and subsequently the drinks we had ordered and some bread. From the point that she took our food order and when we received it seemed fairly Quick. Everyone was happy with their food, it was seasoned pretty well and everything came out correctly. We ordered our cheesecakes to go and got those fairly quickly too. I was pretty happy with tonight because it was busy but we didn't feel forgotten or like we were a burden to our waitress. There are so many new restaurants around the area so it will probably be a while before we are back, but we aren't taking it off the table of one our favorite restaurants. I love that, like starbucks, no matter which one you go to, it is pretty much consistent."
Lindsay S.,"Surprise, AZ",0,6,,1.0,10/15/2017,"My husband and I went out for our 16th wedding anniversary.  Now we do not go out often, we don't have a lot of extra money so eating out is a treat we do on special occasions, kids birthdays etc...so this was a big deal.  Ordered the fried Calamari, greasy and rubbery.  Bread was hard.  I ordered the Pasta Carbonara with grilled shrimp...$23.  It was so greasy and the shrimp were rubbery.  This was the first time I've ever sent food back.  My husband ordered the steak tacos, they were cold.  Since he was so hungry, he ate them anyway but regretted it later that night.  The only good thing was Diane A. our waitress was amazing.  Hopefully she got to keep the whole tip!  So much for a romantic anniversary dinner without the kiddos!"
Mia A.,"Phoenix, AZ",15,9,16,2.0,11/25/2017,"I had the crab bites and they were okay, nothing too impressive and I had the loaded baked potato soup which was really bad. My girlfriend had a cucumber mojito and it had too much mint and the mint leaves were going bad. Same thing with the green leaves in the salads. The two people I was with ordered different salads. Both were crap. Someone ordered a burger and that was apparently good but the person that said that doesn't have very high standards for burgers. Not worth the money."
Katie M.,"Glendale, AZ",232,182,225,3.0,8/8/2016,So living in the Glendale area I have now given this Cheesecake Factory two chances I'm a sucker for Cheesecake Factory.. I love eating at cheesecake factory I love their food I love their bread and especially the cheesecakes  But for some reason this location has now disappointed me twice. Total bummer bc well my fiancé and our kids love coming here a.k.a. they love the bread lol!  So we first went to this location two weeks ago.. We were a huge party of 10 which was fine  you know it was dinner time no complaints on our waiter... I ordered the chicken lettuce wraps or as they call them lettuce tacos. Nothing taco about only taco thing was it came out in the weird taco holder stand..this is where I don't understand what happen I ordered chicken lettuce wraps I would expect there to be chicken in my lettuce wrap not one little sliver of chicken probably 1 inch long I want chicken I'm hungry! So already I'm disappointed. We came back here the other night and our kids food(they get the kids pizza) was fine my fiancé's food was phenomenal(he usually gets the steak or salmon) and my food again not so great. I ordered the Parmesan crusted chicken which I've ordered at other Cheesecake factory's and I've never had this issue that my chicken crusted Parmesan was soggy. Usually it's thin crispy not this one soggy like it was old and warmed up ... Crazy part is I know not to order those items again bc I know we will be back... Just I know for next time.. Anyway I still love Cheesecake Factory.. Just beware of soggy chicken lol
Bob S.,"Buckeye, AZ",0,10,1,4.0,10/2/2017,First time in a long time at the cheesecake factory and i was very pleased with my lunch. Service was perfect and the food was plentiful and delicious. Would be 5 stars if not for the prices. Ouch.
Brad D.,"Surprise, AZ",255,48,107,5.0,10/26/2016,"I've never had a bad experience here. Professional staff, great atmosphere and delicious food! I use to think the menu (roughly 8+ pages) and variety of cuisines was too much but that's gone out the window. Whenever I'm indecisive on what I'm craving, I'll go here and have a great selection. They even have a skinny licious menu if your cutting down on calories! I have to commend the all around service you get here. Very professional! The servers have years of experience and it shows. The GM, Chad, is awesome and is always a pleasure to see.  What I like and recommend... Appetizers: stuffed mushrooms, chicken samosas, crab bites, and the ahi carpaccio. Entrees:  hibachi steak, Jamaican black pepper shrimp, miso salmon, French dip and Evelyn's favorite pasta!  Dessert: chocolate chip cookie dough, pumpkin cheesecake and the salted caramel."
Jerry R.,"Mesa, AZ",5,24,,2.0,2/18/2017,"I have been to many other Cheesecake Factory locations in the past and they were all amazing. This location has some issues. THE PORTION SIZES ARE SO SMALL! I got stuffed mushrooms and they are usually about the size of quarters or larger. These were the size of dimes and burned. I returned them and asked for a fresh plate. The next plate they were very small and dry. Just nowhere near the size or quality I expedited, so I returned them. The manager came and apologized and asked if he could anything to make it better. My wife'se tacos were very small as well, and the tortillas were not the same as the ones used at other locations. Our friend that went along with us said her sandwhich was also very small. Server n didn't bring out bread. Lame. Great manager, but I won't return. I'll stick with the Chandler Mall."
